{
  "incident_id": "INC-002",
  "title": "Database timeouts and connection pool exhaustion in orders service",
  "severity": "CRITICAL",
  "started_at": "2026-09-26T11:16:30Z",
  "services": [
    "order-service",
    "orders-db",
    "api-gateway"
  ],
  "logs": [
    {
      "timestamp": "2026-09-26T11:15:30Z",
      "service": "orders-db",
      "level": "WARN",
      "message": "Connection pool usage exceeded 85% (425/500 connections in use)"
    },
    {
      "timestamp": "2026-09-26T11:16:30Z",
      "service": "orders-db",
      "level": "FATAL",
      "message": "max_connections reached (500/500). Rejecting incoming client sockets",
      "error_code": "ERR_TOO_MANY_CONNECTIONS"
    },
    {
      "timestamp": "2026-09-26T11:16:35Z",
      "service": "order-service",
      "level": "ERROR",
      "message": "HikariPool-1 - Connection is not available, request timed out after 30000ms",
      "trace_id": "tr-db-timeout-1",
      "error_code": "SQL_POOL_EXHAUSTED"
    },
    {
      "timestamp": "2026-09-26T11:16:50Z",
      "service": "order-service",
      "level": "ERROR",
      "message": "Unable to acquire JDBC Connection to orders-db. Transaction rollback initiated",
      "trace_id": "tr-db-timeout-2"
    },
    {
      "timestamp": "2026-09-26T11:17:10Z",
      "service": "api-gateway",
      "level": "ERROR",
      "message": "Order creation failed: HTTP 504 Gateway Timeout from order-service",
      "trace_id": "tr-gw-202"
    }
  ],
  "metrics": [
    {
      "timestamp": "2026-09-26T11:15:00Z",
      "service": "orders-db",
      "metric_name": "db_connections_active",
      "value": 180.0,
      "unit": "count"
    },
    {
      "timestamp": "2026-09-26T11:16:00Z",
      "service": "orders-db",
      "metric_name": "db_connections_active",
      "value": 410.0,
      "unit": "count"
    },
    {
      "timestamp": "2026-09-26T11:16:30Z",
      "service": "orders-db",
      "metric_name": "db_connections_active",
      "value": 500.0,
      "unit": "count"
    },
    {
      "timestamp": "2026-09-26T11:17:00Z",
      "service": "orders-db",
      "metric_name": "db_connections_active",
      "value": 500.0,
      "unit": "count"
    },
    {
      "timestamp": "2026-09-26T11:16:30Z",
      "service": "orders-db",
      "metric_name": "pool_exhaustion_ratio",
      "value": 1.0,
      "unit": "ratio"
    },
    {
      "timestamp": "2026-09-26T11:16:30Z",
      "service": "order-service",
      "metric_name": "db_query_latency_p95",
      "value": 31200.0,
      "unit": "ms"
    },
    {
      "timestamp": "2026-09-26T11:16:30Z",
      "service": "order-service",
      "metric_name": "cpu_utilization",
      "value": 18.0,
      "unit": "percentage"
    }
  ],
  "traces": [
    {
      "trace_id": "tr-db-timeout-1",
      "span_id": "sp-gw-2",
      "parent_span_id": null,
      "service": "api-gateway",
      "operation": "POST /api/orders",
      "duration_ms": 30200.0,
      "status_code": 504,
      "timestamp": "2026-09-26T11:16:35Z",
      "error": true,
      "error_message": "Gateway Timeout"
    },
    {
      "trace_id": "tr-db-timeout-1",
      "span_id": "sp-ord-2",
      "parent_span_id": "sp-gw-2",
      "service": "order-service",
      "operation": "CreateOrderHandler",
      "duration_ms": 30150.0,
      "status_code": 500,
      "timestamp": "2026-09-26T11:16:35Z",
      "error": true,
      "error_message": "HikariPool-1 connection acquisition timeout"
    },
    {
      "trace_id": "tr-db-timeout-1",
      "span_id": "sp-db-2",
      "parent_span_id": "sp-ord-2",
      "service": "orders-db",
      "operation": "TCP_CONNECT orders-db:5432",
      "duration_ms": 30000.0,
      "status_code": 503,
      "timestamp": "2026-09-26T11:16:35Z",
      "error": true,
      "error_message": "Connection refused / max_connections reached"
    }
  ],
  "deployments": [
    {
      "deployment_id": "dep-081",
      "service": "order-service",
      "version": "v2.1",
      "previous_version": "v2.0",
      "deployed_at": "2026-09-23T11:15:00Z",
      "status": "SUCCESS",
      "commit_hash": "f128bc0",
      "changelog": "Routine order validation patch"
    }
  ],
  "dependencies": [
    {
      "source": "api-gateway",
      "target": "auth-service",
      "type": "sync_http",
      "critical": true
    },
    {
      "source": "api-gateway",
      "target": "order-service",
      "type": "sync_http",
      "critical": true
    },
    {
      "source": "api-gateway",
      "target": "payment-service",
      "type": "sync_http",
      "critical": true
    },
    {
      "source": "order-service",
      "target": "inventory-service",
      "type": "sync_http",
      "critical": true
    },
    {
      "source": "order-service",
      "target": "orders-db",
      "type": "database",
      "critical": true
    },
    {
      "source": "order-service",
      "target": "payment-service",
      "type": "sync_http",
      "critical": true
    },
    {
      "source": "payment-service",
      "target": "payment-db",
      "type": "database",
      "critical": true
    },
    {
      "source": "payment-service",
      "target": "external-payment-provider",
      "type": "external_api",
      "critical": false
    }
  ]
}