{
  "incident_id": "INC-005",
  "title": "CPU saturation and queue buildup in order service",
  "severity": "HIGH",
  "started_at": "2026-09-26T12:45:50Z",
  "services": [
    "order-service",
    "api-gateway"
  ],
  "logs": [
    {
      "timestamp": "2026-09-26T12:45:40Z",
      "service": "order-service",
      "level": "WARN",
      "message": "Worker thread pool exhaustion warning: 96/100 worker threads busy"
    },
    {
      "timestamp": "2026-09-26T12:45:55Z",
      "service": "order-service",
      "level": "WARN",
      "message": "Request queue size backing up: queue depth 380 items (normal < 10)"
    },
    {
      "timestamp": "2026-09-26T12:46:15Z",
      "service": "order-service",
      "level": "ERROR",
      "message": "Request rejected due to thread pool saturation: ThreadPoolExecutor rejected ExecutionException",
      "error_code": "ERR_THREAD_SATURATION"
    },
    {
      "timestamp": "2026-09-26T12:46:30Z",
      "service": "api-gateway",
      "level": "ERROR",
      "message": "HTTP 503 Service Unavailable received from order-service"
    }
  ],
  "metrics": [
    {
      "timestamp": "2026-09-26T12:45:00Z",
      "service": "order-service",
      "metric_name": "cpu_utilization",
      "value": 28.0,
      "unit": "percentage"
    },
    {
      "timestamp": "2026-09-26T12:45:40Z",
      "service": "order-service",
      "metric_name": "cpu_utilization",
      "value": 78.5,
      "unit": "percentage"
    },
    {
      "timestamp": "2026-09-26T12:46:00Z",
      "service": "order-service",
      "metric_name": "cpu_utilization",
      "value": 98.4,
      "unit": "percentage"
    },
    {
      "timestamp": "2026-09-26T12:46:30Z",
      "service": "order-service",
      "metric_name": "cpu_utilization",
      "value": 99.1,
      "unit": "percentage"
    },
    {
      "timestamp": "2026-09-26T12:46:30Z",
      "service": "order-service",
      "metric_name": "queue_depth",
      "value": 420.0,
      "unit": "count"
    },
    {
      "timestamp": "2026-09-26T12:46:30Z",
      "service": "order-service",
      "metric_name": "latency_p95",
      "value": 1850.0,
      "unit": "ms"
    },
    {
      "timestamp": "2026-09-26T12:46:30Z",
      "service": "orders-db",
      "metric_name": "cpu_utilization",
      "value": 14.0,
      "unit": "percentage"
    }
  ],
  "traces": [
    {
      "trace_id": "tr-cpu-501",
      "span_id": "sp-gw-5",
      "parent_span_id": null,
      "service": "api-gateway",
      "operation": "POST /api/orders/batch",
      "duration_ms": 1900.0,
      "status_code": 503,
      "timestamp": "2026-09-26T12:46:15Z",
      "error": true,
      "error_message": "Service Unavailable"
    },
    {
      "trace_id": "tr-cpu-501",
      "span_id": "sp-ord-5",
      "parent_span_id": "sp-gw-5",
      "service": "order-service",
      "operation": "BatchOrderProcessor",
      "duration_ms": 1880.0,
      "status_code": 503,
      "timestamp": "2026-09-26T12:46:15Z",
      "error": true,
      "error_message": "Thread pool rejected task"
    }
  ],
  "deployments": [],
  "dependencies": [
    {
      "source": "api-gateway",
      "target": "auth-service",
      "type": "sync_http",
      "critical": true
    },
    {
      "source": "api-gateway",
      "target": "order-service",
      "type": "sync_http",
      "critical": true
    },
    {
      "source": "api-gateway",
      "target": "payment-service",
      "type": "sync_http",
      "critical": true
    },
    {
      "source": "order-service",
      "target": "inventory-service",
      "type": "sync_http",
      "critical": true
    },
    {
      "source": "order-service",
      "target": "orders-db",
      "type": "database",
      "critical": true
    },
    {
      "source": "order-service",
      "target": "payment-service",
      "type": "sync_http",
      "critical": true
    },
    {
      "source": "payment-service",
      "target": "payment-db",
      "type": "database",
      "critical": true
    },
    {
      "source": "payment-service",
      "target": "external-payment-provider",
      "type": "external_api",
      "critical": false
    }
  ]
}