{
  "incident_id": "INC-004",
  "title": "External payment provider gateway outage",
  "severity": "HIGH",
  "started_at": "2026-09-26T12:30:45Z",
  "services": [
    "payment-service",
    "external-payment-provider",
    "api-gateway"
  ],
  "logs": [
    {
      "timestamp": "2026-09-26T12:30:45Z",
      "service": "payment-service",
      "level": "WARN",
      "message": "Downstream call to api.stripe-mock.internal timed out after 5000ms"
    },
    {
      "timestamp": "2026-09-26T12:30:55Z",
      "service": "payment-service",
      "level": "ERROR",
      "message": "Circuit breaker OPEN for external-payment-provider (failure rate 88% > threshold 50%)",
      "error_code": "CIRCUIT_BREAKER_OPEN"
    },
    {
      "timestamp": "2026-09-26T12:31:10Z",
      "service": "payment-service",
      "level": "ERROR",
      "message": "External payment authorization failed: 504 Gateway Timeout from upstream bank partner",
      "trace_id": "tr-ext-401"
    },
    {
      "timestamp": "2026-09-26T12:31:20Z",
      "service": "payment-service",
      "level": "INFO",
      "message": "Internal payment-service local worker threads healthy, CPU 15%, memory 22%"
    }
  ],
  "metrics": [
    {
      "timestamp": "2026-09-26T12:30:00Z",
      "service": "payment-service",
      "metric_name": "external_call_latency_p95",
      "value": 180.0,
      "unit": "ms"
    },
    {
      "timestamp": "2026-09-26T12:30:45Z",
      "service": "payment-service",
      "metric_name": "external_call_latency_p95",
      "value": 4950.0,
      "unit": "ms"
    },
    {
      "timestamp": "2026-09-26T12:31:15Z",
      "service": "payment-service",
      "metric_name": "external_call_error_rate",
      "value": 0.92,
      "unit": "percentage"
    },
    {
      "timestamp": "2026-09-26T12:31:15Z",
      "service": "payment-service",
      "metric_name": "cpu_utilization",
      "value": 15.2,
      "unit": "percentage"
    },
    {
      "timestamp": "2026-09-26T12:31:15Z",
      "service": "payment-service",
      "metric_name": "memory_rss_bytes",
      "value": 524288000.0,
      "unit": "bytes"
    }
  ],
  "traces": [
    {
      "trace_id": "tr-ext-401",
      "span_id": "sp-gw-4",
      "parent_span_id": null,
      "service": "api-gateway",
      "operation": "POST /api/pay/authorize",
      "duration_ms": 5050.0,
      "status_code": 504,
      "timestamp": "2026-09-26T12:31:10Z",
      "error": true,
      "error_message": "Gateway Timeout"
    },
    {
      "trace_id": "tr-ext-401",
      "span_id": "sp-pay-4",
      "parent_span_id": "sp-gw-4",
      "service": "payment-service",
      "operation": "AuthorizePayment",
      "duration_ms": 5020.0,
      "status_code": 504,
      "timestamp": "2026-09-26T12:31:10Z",
      "error": true,
      "error_message": "External provider timeout"
    },
    {
      "trace_id": "tr-ext-401",
      "span_id": "sp-ext-4",
      "parent_span_id": "sp-pay-4",
      "service": "external-payment-provider",
      "operation": "POST https://partner.bank.api/v1/charge",
      "duration_ms": 5000.0,
      "status_code": 504,
      "timestamp": "2026-09-26T12:31:10Z",
      "error": true,
      "error_message": "SocketTimeoutException: Read timed out"
    }
  ],
  "deployments": [],
  "dependencies": [
    {
      "source": "api-gateway",
      "target": "auth-service",
      "type": "sync_http",
      "critical": true
    },
    {
      "source": "api-gateway",
      "target": "order-service",
      "type": "sync_http",
      "critical": true
    },
    {
      "source": "api-gateway",
      "target": "payment-service",
      "type": "sync_http",
      "critical": true
    },
    {
      "source": "order-service",
      "target": "inventory-service",
      "type": "sync_http",
      "critical": true
    },
    {
      "source": "order-service",
      "target": "orders-db",
      "type": "database",
      "critical": true
    },
    {
      "source": "order-service",
      "target": "payment-service",
      "type": "sync_http",
      "critical": true
    },
    {
      "source": "payment-service",
      "target": "payment-db",
      "type": "database",
      "critical": true
    },
    {
      "source": "payment-service",
      "target": "external-payment-provider",
      "type": "external_api",
      "critical": false
    }
  ]
}